Year,Month,Day,Time,End Year,End Month,End Day,Display Date,End Time,Headline,Text,Media,Media Credit,Media Caption,Media Thumbnail,Type,Group,Background
2015,3,19,14:01,,,,,,三貂嶺車站,三貂嶺車站是台灣唯一一座公路無法抵達的車站，要搭車的旅客必須從上游的鐵路橋旁的人行步道跨越河床徒步抵達。,https://www.flickr.com/photos/192855130@N05/51145905941/in/photostream/,Jonathan Chang,三貂嶺車站一景，可見其狹小的站體,,,,
2013,2,28,14:58,,,,,,蘭陽博物館,蘭陽博物館位於台灣宜蘭縣頭城鎮，是台灣第一座縣級博物館。其建築特色為當地常見的單面山造型，建築師姚仁喜使用大小不一的石材構成外牆，呈現以韋瓦第小提琴協奏曲《四季》為靈感的主題。,https://drive.google.com/file/d/1Yp4z5dnrqNTCe8flaZzVVa-aWNEbGssF/view?usp=sharing,Alfredo Chiang,蘭陽博物館及濕地公園，由遠處觀看與龜山島神似,,,,
2017,1,14,9:55,,,,,,台中國家歌劇院,台中國家歌劇院位於台灣台中市西屯區七期重劃區內，為日本建築師伊東豐雄所設計，內含歌劇院、中劇院、小劇院及小型戶外劇場、角落沙龍、凸凸廳等空間，頂樓則設有空中花園。於2016年9月30日正式啟用，共有地下2層，地上6層，其建築設計靈感來自人類最原始的「樹屋」、「洞窟」等概念而成的「美聲涵洞」，因此內外牆皆為曲面牆，施工難度甚高。,https://drive.google.com/file/d/1DUYTuDpNBaVILsVK3BouYkp16iw6aOzh/view?usp=sharing,Alfredo Chiang,台中國家歌劇院正面，前有噴水池廣場,,,,
2018,8,29,14:37,,,,,,Suzzallo Library,蘇薩羅圖書館 (Suzzallo Library) 是美國西雅圖華盛頓大學 (University of Washington) 的主圖書館，為該校的地標。其學院哥德式 (Collegiate Gothic) 建築為其特色，其名來自華盛頓大學前校長Henry Suzzallo之名，於1963年完工啟用。,https://drive.google.com/file/d/1hAezIT0-wqrmcd4VW-f_q0F2JwKOjsmR/view?usp=sharing,Alfredo Chiang,蘇薩羅圖書館閱覽室一景，有如電影《哈利波特》中的場景,,,,
2019,5,24,21:08,,,,,,台北府城北門,台北府城北門，承恩門，是位於台灣台北市中正區的清代城門建築，為台北府城五座城門中唯一一座完整保留原始樣貌的城門，完成於清光緒十年 (1884) ，位於台北市忠孝西路、延平南路及博愛路交叉口，是台北市建城的標的建築之一，城門台座的基石採大直北勢湖一帶的安山岩建構而成，牆面則為紅磚。往昔曾欠缺維護並被忠孝橋引道等高架道路包圍，除有礙觀瞻之外也對城門有一定程度的影響，至2016年「西區門戶計畫」拆除周圍高架道路後，成為台北市的歷史地標。,https://drive.google.com/file/d/1Hb5kgGAamsmD3BLTV-ceOL1cplNMDhEE/view?usp=sharing,Alfredo Chiang,北門夜景，此為拆除忠孝橋引道之後的景觀,,,,
2021,4,30,19:11,,,,,,衛武營國家藝術文化中心,"衛武營國家藝術文化中心位於台灣高雄市鳳山區，是全球最大的單一屋頂綜合劇院，擁有亞洲最大的管風琴。其建築為荷蘭建築師法蘭馨‧侯班 (Francine Houben) 所設計，包含歌劇院、音樂廳、戲劇院及表演廳，另外還有一戶外劇場。
衛武營原為中華民國陸軍新兵訓練中心，2003年重新規劃為藝術中心、都會公園及特定商業區，其中10公頃為藝術文化中心之範圍。2010年動工興建，2018年正式啟用，同年獲得紐約設計獎 (New York Design Awards)，2019年榮登美國《時代》雜誌「2019 年世界最佳景點」
A former Japanese military base is now home to the largest performing-­arts center in the world under a single roof. Opened in October 2018, the National Kaohsiung Center for the Arts spans 25 acres in the south of Taiwan. The compound, designed by the Dutch architecture firm Mecanoo, features a roof resembling a canopy inspired by the banyan trees commonly found in the region, which dips to the ground to form the base of an outdoor theater for up to 20,000. Inside, the four other performance venues have already seen world-class acts, including the London Philharmonic Orchestra. —Hillary Leung",https://drive.google.com/file/d/1FCMoAcwlZkPao7st8WnFcXmdiVhvHqDT/view?usp=sharing,Alfredo Chiang,衛武營國家藝術文化中心夜景,,,,